,Next,Standard,294,Virtual,1,Total Errors,1,,,Manca l'ASIN,Inviato ad Amazon,,Inviato all'assistenza,,,,,
,box,Temporary,16,,,,,,,Manca lo SKU,In waiting,,Scartato,#REF!,,,,
,Box,Box Type,Picked,Shipped,LPN,Brand,Additional Info,Other Info,Product Description,Destination,Verification Request,State (Amz),Reason (Amz),Customer Notes,ASIN,SKU,FNSKU,Notes
,292,Standard,05/07/2024,,LPNHK245729750,Orno,Missing components,,"ORNO OR-ZS-853 Elektronisches Türschloss mit Touch-Tastatur und Smart-Funktion - Fingerabdruckleser, Bluetooth 4.0 (Schwarz)",Dispose,,CUSTOMER_DAMAGED,NO_REASON_GIVEN,,B09J596FCV,5908254819001,B09J596FCV,
,228,Standard,05/07/2024,25/09/2024,LPNHK223029118,Abc Design,Missing packaging,,ABC Design Adapter Limbo - ABC Design Tulip/Maxi-Cosi/Cybex Adapter für Babyschalen & Autositz - passend für City-Kinderwagen Limbo - Farbe: black,Dispose,,CUSTOMER_DAMAGED,NO_REASON_GIVEN,,B08BG3QLLP,25-LJL5-YWWU,X001NLFTRH,
,228,Standard,05/07/2024,26/09/2024,LPNA049977877,Arizer,Signs of usage,,Arizer Solo 2 (nero),Dispose,,DEFECTIVE,QUALITY_UNACCEPTABLE,non sono soddisfatto della qualità del vapore,B071GRQBQR,PU-M1M4-GA85,X001W891UH,
,7,Virtual,05/07/2024,,LPNHK255126230,Arizer,Signs of usage,X,"Arizer XQ2 Tisch-Vaporizer, Schwarz",Dispose,,CUSTOMER_DAMAGED,DAMAGED_BY_CARRIER,,B09NRT4QYY,SC-NOBC-70KG,X001W97A8B,
,228,Standard,05/07/2024,26/09/2024,LPNHK112039907,Didiesse,Damaged product,,"Didiesse Multicolore Frog Collection Kaffeepad-Maschine, 650, Aluminium, Couleur",Dispose,,CUSTOMER_DAMAGED,NO_REASON_GIVEN,,B07B38K95Q,CH-WN3P-8SIT,X001XCY89L,
,2,Virtual,05/07/2024,,Lpna032054087,Kerbl,Damaged product,,"Kerbl 18192 Tosatrice, Farm Clipper 4, 200 W, 31/15 Z, bovino/Cavallo",Dispose,,DEFECTIVE,DEFECTIVE,,B01BBK2Y24,SF-ZDHT-6L4E,X001GZTVXX,
,4,Virtual,05/07/2024,26/09/2024,LPNA031422404,Didiesse,Missing packaging,COLORE??????????,Didieese Frog Base Revolution,Dispose,,-,-,-,-,-,-,
,228,Standard,05/07/2024,25/09/2024,LPNRP007463425,Tielle,Damaged packaging,,"Sporlastic FOOT-UP Fußheberorthese Gr.1 schwarz 07810, 500 g",Dispose,,CUSTOMER_DAMAGED,SWITCHEROO,,B002KKG87W,EX-TEGV-CCB0,X001WP34PD,
,228,Standard,05/07/2024,25/09/2024,LPNRP021050375,Tielle,Damaged packaging,,"Sporlastic FOOT-UP Fußheberorthese Gr.1 schwarz 07810, 500 g",Dispose,,DEFECTIVE,NOT_COMPATIBLE,Zu klein.,B002KKG87W,EX-TEGV-CCB0,X001WP34PD,
,228,Standard,05/07/2024,25/09/2024,LPNHK177806469,Tielle,Damaged packaging,????????????,-,Dispose,,-,-,-,-,-,-,
,7,Temporary,05/07/2024,,LPNIC108789782,Globus,Missing components,,Globus - Paquete de batería para MD - PL - MG,Dispose,,DEFECTIVE,DEFECTIVE,"Se ha colocado la batería en su aparato compatible, está bien conectada, pero no enciende, esta batería no funciona. Puedo aportar vídeo.",B00M0MJ4XK,NA-WGB3-40PX,X0018QS7Z3,
,228,Standard,05/07/2024,25/09/2024,LPNHK254789865,Tellur,Damaged packaging,,"TELLUR Dash Patrol DC1-Autokamera, FullHD 1080P, G-Sensor erkennt Aufprall und startet die Aufnahme, Parküberwachungsfunktion, Schwarz",Dispose,,CUSTOMER_DAMAGED,QUALITY_UNACCEPTABLE,,B08T1W9MBQ,amzn.gr.PY-O4LL-M9T4-xnJBef57W2PHCKtH-LN,X001XS8G1V,
,228,Standard,05/07/2024,25/09/2024,LPNHK254453894,Hudora,Damaged product,,"HUDORA Kabel-Schloss Fahrrad Scooter, Zahlenschloss, 14492",Dispose,,DEFECTIVE,DEFECTIVE,Schloss geht nicht mehr auf. Code bekannt,B071S7ZM5Y,05-1SP3-KEVI,B071S7ZM5Y,
,228,Standard,05/07/2024,25/09/2024,LPNHE831300225,Arizer,Signs of usage,,Smono 3.3 Vaporizzatore - Nuovissima versione - senza nicotina,Dispose,,CUSTOMER_DAMAGED,QUALITY_UNACCEPTABLE,,B07YBD3QB8,KQ-BITS-E6NQ,X001WBB4F9,
,289,Standard,05/07/2024,,LPNHE831186472,Roten,Signs of usage,,"RO+TEN - Daumfix ortesi per pollice - L, Sinistra",Dispose,,CUSTOMER_DAMAGED,ORDERED_WRONG_ITEM,,B0100YWX6Y,G9-NJFP-5XHD,X001RWJIFL,
,228,Standard,05/07/2024,25/09/2024,LPNRP011363543,Tielle,Damaged packaging,,"Sporlastic FOOT-UP Fußheberorthese Gr.1 schwarz 07810, 500 g",Dispose,,CUSTOMER_DAMAGED,UNWANTED_ITEM,,B002KKG87W,EX-TEGV-CCB0,X001WP34PD,
,228,Standard,05/07/2024,25/09/2024,LPNHK227071044,Tielle,Damaged packaging,,"Sporlastic FOOT-UP Fußheberorthese Gr.2 schwarz 07810, 500 g, 03549318",Dispose,,DEFECTIVE,NOT_AS_DESCRIBED,Beschreibung nicht in deutsch,B002KKO0Q8,OA-5S6V-K1W8,X001WP34XP,
,228,Standard,05/07/2024,25/09/2024,LPNHK227009732,Tielle,Damaged packaging,,"Sporlastic FOOT-UP Fußheberorthese Gr.2 schwarz 07810, 500 g, 03549318",Dispose,,DEFECTIVE,NOT_AS_DESCRIBED,Beschreibung nicht in deutsch,B002KKO0Q8,OA-5S6V-K1W8,X001WP34XP,
,166,Standard,05/07/2024,25/09/2024,LPNHK112633980,Denix,Damaged product,X,Denix Thompson M1928 Submachine Gun Nachbildung,Dispose,,CUSTOMER_DAMAGED,DAMAGED_BY_CARRIER,,B001MFLR90,B001MFLR90,X001WUTF7J,
,261,Standard,05/07/2024,25/09/2024,LPNHL962380109,Dinobike,,,"Dino Bikes Vélo Licorne 14"" 35,6 Filles, Blanc/Rose, 35,56 cm",New inventory,,CUSTOMER_DAMAGED,UNWANTED_ITEM,,B07NFM32LG,1R-HX0M-GWPP,X001XUTZY1,
,261,Standard,05/07/2024,25/09/2024,LPNHL961008757,Dinobike,,,Dino Bikes Jungen Kinderfahrrad grün 412U Jungenfahrrad - 12 Zoll | TÜV geprüft | Original | Kinderrad mit Stützrädern - Das Fahrrad als Geschenk für Jungen,New inventory,,CUSTOMER_DAMAGED,NOT_AS_DESCRIBED,,B01MDS5VHF,EH-YV7R-N7ME,B01MDS5VHF,
,261,Standard,05/07/2024,25/09/2024,LPNHK110375000,Dinobike,,,Dino Bikes - 12 Zoll Kinderfahrrad Peppa Wutz Pig - Mädchen Fahrrad mit abnehmbaren Stützrädern ab 2 Jahren - Kinderrad mit Frontkorb & Puppenträger - verstellbare Sattel- & Lenkerhöhe (Pink),New inventory,,CUSTOMER_DAMAGED,DEFECTIVE,,B0BQYYY6B2,5I-AY4T-LUOW,X001YKD4FL,
,261,Standard,05/07/2024,25/09/2024,LPNHK109770387,Dinobike,,,"Dino Bikes- Vélo, 124 RL-Un, Multicolore",New inventory,,CUSTOMER_DAMAGED,NOT_AS_DESCRIBED,,B07NFLS6JY,I2-I8V2-D1LO,X001XUWM9L,
,261,Standard,05/07/2024,25/09/2024,LPNHL960782019,Dinobike,,,Dino Bikes - 12 Zoll Kinderfahrrad Peppa Wutz Pig - Mädchen Fahrrad mit abnehmbaren Stützrädern ab 2 Jahren - Kinderrad mit Frontkorb & Puppenträger - verstellbare Sattel- & Lenkerhöhe (Pink),New inventory,,CUSTOMER_DAMAGED,NOT_AS_DESCRIBED,,B0BQYYY6B2,5I-AY4T-LUOW,X001YKD4FL,
,3,Virtual,15/07/2024,,LPNHE827994076,Soundmaster,,,"Soundmaster DAB60WE - Radio Da Doccia, Radio Da Piscina, Radio Portatile con DAB+/FM-RDS, Cassa Bluetooth Doccia, 20 Stazioni Preimpostate, Funzione Vivavoce, Rilevatore di Movimento",Dispose,,DEFECTIVE,DEFECTIVE,Prodotto è stato aperto. È rotto. Puzza. È sporco. Manca di pezzi niente cordino anello etc. E non prende alcuna radio. Vergognoso. Sin vede che è articolo rientrato. Non va buttatelo,B09779BFMM,OC-7PYA-CBVM,X001V60JSN,
,228,Standard,15/07/2024,15/07/2024,LPNHE815964861,Blaupunkt,,,"BLAUPUNKT 2001018000000 Bremen SQR 46 DAB, zwart",Dispose,,DEFECTIVE,DEFECTIVE,"I got sent a CLEARLY open boxed item and the device does not function. Neither does it in a second car, while both radios interchangeable work in each other. I probably got sent another mans problem",B07XVMBKW4,54-WBX6-EMB8,X001YY5D0L,
,2,Virtual,15/07/2024,,LPNHK237238321,Soundmaster,,,Soundmaster UR2045SI DAB+ und UKW-RDS Küchenunterbauradio mit Bluetooth,Dispose,,DEFECTIVE,QUALITY_UNACCEPTABLE,"Ich komme mit den Funktionen überhaupt nicht zurecht, bekomme nicht die gewünschten Sender, setup-Funktion kriege ich nicht hin, zurück auf Werkseinstellungen auch nicht",B07TBTJYST,9G-DT10-4LH4,X001Y51OB7,
,2,Virtual,15/07/2024,,LPNHE831477548,Storz & Bickel,,,CRAFTY+ Vaprizzatore (2021),Dispose,,CUSTOMER_DAMAGED,DEFECTIVE,,B09M8XNPT2,ZU-N8CZ-8BYL,X001Z6J5CZ,
,228,Standard,15/07/2024,15/07/2024,LPNHE837420994,Storz & Bickel,,,CRAFTY+ Vaporizer (2021),Dispose,,CUSTOMER_DAMAGED,NO_REASON_GIVEN,,B09M8XNPT2,ZU-N8CZ-8BYL,X001Z6J5CZ,
,3,Virtual,15/07/2024,,LPNHE831497482,Storz & Bickel,,,"Storz & Bickel Mighty +, Mighty Plus, ultima edizione 2021/2022 con Supercharge, USB C, più potente che mai!",Dispose,,DEFECTIVE,QUALITY_UNACCEPTABLE,Il vaporizzatore non emette vapore sufficiente neppure ad alta temperatura,B09L9VYZHC,SG-M52D-69L1,X001WJ2315,
,2,Virtual,15/07/2024,,LPNHE833179342,Arizer,,,Arizer Air SE (Bianco scuro) (Senza nicotina),Dispose,,DEFECTIVE,DAMAGED_BY_FC,Bocchino vetro spezzato. L’oggetto non appare essere nuovo o mai usato.,B0CBDVQ5DK,6S-IO8M-QKX2,X002052NT7,
,228,Standard,16/07/2024,16/07/2024,LPNIC097796061,Storz & Bickel,,,MIGHTY Vaporizador,Dispose,,CUSTOMER_DAMAGED,NOT_COMPATIBLE,,B00P2K1UQ6,D9-JK9S-5MYF,X001WJ3KRV,
,3,Virtual,16/07/2024,,LPNHK180078913,Emerio,,,"Emerio FH-106737.2, TESTSIEGER Note 1.5, kleiner kompakter portabler Heizlüfter für 20 m², 2 Heizleistungen + Ventilatorfunktion, verstellbarer The",Dispose,,DEFECTIVE,DEFECTIVE,Heizt nicht mehr.,B09N43LTMW,7333282007959,B09N43LTMW,
,236,Standard,16/07/2024,16/07/2024,LPNHK255236282,Kerbl,,,"Kerbl - Set mit Infrarotstrahlen, 250 W, Reflektorhalterung mit Schutzgitter, Kette zur Befestigung und Kabel 2,5 m",Dispose,,DEFECTIVE,NOT_COMPATIBLE,Noch neu OVP,B093CHJ7QC,MJ-RZWI-NV9N,X001CZZR71,
,236,Standard,16/07/2024,16/07/2024,LPNHE823435101,Urmet,,scatola distrutta,"Urmet 1130/16 Interphone universel pour installations traditionnelles 5 fils 4 + N et 2 fils 1 + N, Blanc",Dispose,,DEFECTIVE,MISSING_PARTS,Il manque le cache bouton à l interphone ( en bas a droite bouton ouverture de porte).  L article n est pas complet. Photos à l appui si besoin,B07D8Z1G2L,QF-N17R-XAZB,X001TL49K9,
,236,Standard,16/07/2024,16/07/2024,LPNHE766498333,Osculati,,tutto sporco,OSCULATI Projecteur Night Eye en Laiton chromé 12 V,Dispose,,DEFECTIVE,DAMAGED_BY_CARRIER,Il manque le support Le filament halogène est coupé,B00OAEGWV8,AJ-YH10-RK8N,X001US15LH,
,236,Standard,16/07/2024,16/07/2024,LPNHE833243845,Kerbl,,c'è solo la lampada,"Kerbl - Kit Lampada a Raggi Infrarossi Riscaldante da 250 W + Riflettore Portalampada con Griglia di Protezione, Catena per Il Fissaggio e Cavo da 2.5m",Dispose,,DEFECTIVE,MISSING_PARTS,Portalampada mancante,B093CHJ7QC,MJ-RZWI-NV9N,X001CZZR71,
,236,Standard,16/07/2024,16/07/2024,LPNRP021629614,Soundmaster,,manca scatola,Soundmaster DAB60WE DAB+ UKW Bluetooth Badradio Steckdosenradio mit Bewegungsmelder und eingebautem Akku,Dispose,,CUSTOMER_DAMAGED,QUALITY_UNACCEPTABLE,,B09779BFMM,OC-7PYA-CBVM,X001V60JSN,
,238,Standard,16/07/2024,16/07/2024,LPNHK104922711,Singer,,spedita a mano senza script,"Singer Nähmaschine 1409 für Anfänger - 15 Nähvorgänge, 4-Stufen-Öse, Stichlängeneinstellung und einstellbare Zick-Zack-Breite, Rückwärtshebel, Freiarm, inklusive Softcover - Singer Nähmaschine",New inventory,,DEFECTIVE,NOT_COMPATIBLE,Für Gardinen ungeeignet.,B008F8C8AE,4F-37Q6-BGEZ,X001ISGBA9,
,238,Standard,16/07/2024,16/07/2024,LPNHK104457533,Singer,,spedita a mano senza script,"Singer Nähmaschine 1409 für Anfänger - 15 Nähvorgänge, 4-Stufen-Öse, Stichlängeneinstellung und einstellbare Zick-Zack-Breite, Rückwärtshebel, Freiarm, inklusive Softcover - Singer Nähmaschine",New inventory,,CUSTOMER_DAMAGED,UNWANTED_ITEM,,B008F8C8AE,4F-37Q6-BGEZ,X001ISGBA9,
,236,Standard,16/07/2024,16/07/2024,LPNHK226557079,Storz & Bickel,,,"Storz & Bickel Mighty Verdampfer, Kompakt",Dispose,,CUSTOMER_DAMAGED,DAMAGED_BY_CARRIER,,B00P2K1UQ6,D9-JK9S-5MYF,X001WJ3KRV,
,236,Standard,16/07/2024,16/07/2024,LPNRP003552144,Tecnocamp,,manca scatola,"Sporlastic FOOT-UP Fußheberorthese Gr.1 schwarz 07810, 500 g",Dispose,,CUSTOMER_DAMAGED,SWITCHEROO,,B002KKG87W,EX-TEGV-CCB0,X001WP34PD,
,236,Standard,16/07/2024,16/07/2024,LPNHK182629394,Osculati,,manca scatola,"Osculati Rückschlagventil, Schlauch:25/32/38mm",Dispose,,DEFECTIVE,QUALITY_UNACCEPTABLE,Das Rückschlagventil ist undicht sodass es zum Rückfluss kommt.,B00TL8XUJA,BH-5VLI-5EJZ,X001TOVHO7,
,236,Standard,16/07/2024,16/07/2024,LPNRP003700102,Tecnocamp,,manca scatola,"Sporlastic FOOT-UP Fußheberorthese Gr.1 schwarz 07810, 500 g",Dispose,,CUSTOMER_DAMAGED,SWITCHEROO,,B002KKG87W,EX-TEGV-CCB0,X001WP34PD,
,236,Standard,18/07/2024,18/07/2024,LPNHK211829327,Tecnocamp,,manca scatola,"Sporlastic FOOT-UP Fußheberorthese Gr.2 schwarz 07810, 500 g, 03549318",Dispose,,DEFECTIVE,UNDELIVERABLE_UNKNOWN,,B002KKO0Q8,OA-5S6V-K1W8,X001WP34XP,
,236,Standard,18/07/2024,18/07/2024,LPNHE823975909,Western Digital,,,"WD Red interne NAS-Festplatte 3 TB (3,5 Zoll, NAS Festplatte, 5400 U/min, SATA 6 Gbit/s, NASware-Technologie, 256 MB Cache)",Dispose,,DEFECTIVE,DEFECTIVE,Festplatte macht Geräusche,B083XVD1FP,4Z-BNWB-M798,X001YS93ET,
,236,Standard,18/07/2024,18/07/2024,LPNHK250036875,Western Digital,,,"WD Red interne NAS-Festplatte 3 TB (3,5 Zoll, NAS Festplatte, 5400 U/min, SATA 6 Gbit/s, NASware-Technologie, 256 MB Cache)",Dispose,,DEFECTIVE,NOT_COMPATIBLE,Festplatte wird vom NAS nicht erkannt,B083XVD1FP,4Z-BNWB-M798,X001YS93ET,
,236,Standard,18/07/2024,18/07/2024,LPNHE814439603,Western Digital,,,"WD Red NAS Hard Drive WD20EFAX - Hard disk interno da 2 TB, 3,5"", SATA 6GB/S, 5400 rpm, buffer: 256 MB",Dispose,,DEFECTIVE,DEFECTIVE,"Non viene riconosciuto dal NAS WD My Cloud EX2, contrariamente ad altri HDD.  P.S. Il pacco con il quale è stato consegnato era inappropriato (un giro di plastica con le bolle e busta di carta)",B07WVCK2K6,FR-I3CW-EHZ2,X001UMRHM9,
,236,Standard,18/07/2024,18/07/2024,LPNHE578881113,Western Digital,,già inviato una volta e ritornato,-,Dispose,,-,-,-,B008JJLW4M,-,-,
,236,Standard,18/07/2024,18/07/2024,LPNRP002744752,Western Digital,,,"WD Red interne NAS-Festplatte 3 TB (3,5 Zoll, NAS Festplatte, 5400 U/min, SATA 6 Gbit/s, NASware-Technologie, 256 MB Cache)",Dispose,,DEFECTIVE,DEFECTIVE,"Die Festplatte läuft nicht an, die zweite bestellte Platte arbeitet. Beide Platten gleichen Typs, die ich vor drei Jahren bestellt hatte sind ebenfalls komplett ausgefallen...",B083XVD1FP,4Z-BNWB-M798,X001YS93ET,
,236,Standard,18/07/2024,18/07/2024,LPNHE805982712,Lian Li,,,"Lian-Li Strimer Plus V2 24-Pin RGB Mainboardkabel (PW24-PV2) für PC, Schwarz",Dispose,,CUSTOMER_DAMAGED,NO_REASON_GIVEN,,B09ZPJDFJ2,amzn.gr.8O-BD8Y-R1CR-vVWcfMZIZmWlhnc--LN,X001SHD7K7,
,236,Standard,18/07/2024,18/07/2024,LPNHK238790214,Sauermann,,,"Si-83 Pack 1 - Kondensatpumpe 700 l/h für Klimaanlagen, Heizungen, Luftentfeuchter uvm.",Dispose,,DEFECTIVE,NOT_COMPATIBLE,Leider fehlen die Verbindungen,B08BX4WZXH,CL-2JLB-RRPL,X001X0VOZT,
,293,Standard,31/05/2024,,LPNHK254303086,Storz & Bickel,,,"Storz & Bickel Mighty Verdampfer, Kompakt",Dispose,,CUSTOMER_DAMAGED,DAMAGED_BY_CARRIER,,B00P2K1UQ6,D9-JK9S-5MYF,X001WJ3KRV,
,236,Standard,19/07/2024,19/07/2024,LPNHE827657145,Kerbl,,piegata,"Kerbl - Kit Lampada a Raggi Infrarossi Riscaldante da 250 W + Riflettore Portalampada con Griglia di Protezione, Catena per Il Fissaggio e Cavo da 2.5m",Dispose,,CUSTOMER_DAMAGED,ORDERED_WRONG_ITEM,,B093CHJ7QC,MJ-RZWI-NV9N,X001CZZR71,
,236,Standard,19/07/2024,19/07/2024,LPNHE811517719,Bravo,,visibilmente usata e bruciata parzialmente,Bravo Telecamera Wi-Fi 1080p Motorizzata - Da Esterno Con Visione Notturna a Colori,Dispose,,DEFECTIVE,DEFECTIVE,Montato come da istruzioni ma non si connette alla rete con cavo LAN,B0C7HM2MKL,96-TLQZ-KCR6,X001XFC64H,
,3,Virtual,19/07/2024,,LPNHE799661952,Beamz,,,"BeamZ BBP44 Uplighter, LED Par Strahler Akku, IP65, DMX Bühnenbeleuchtung, Discolicht Partylicht Musikgesteurt, Bühnenlicht, Inkl. Fernbedienung - Schwarz",Dispose,,DEFECTIVE,QUALITY_UNACCEPTABLE,Kam schon mit verbogenem Bügel und verschobenen Gummifüßen an,B08WJK5K42,3R-V0YZ-FO18,X001YAO4N7,
,236,Standard,19/07/2024,19/07/2024,LPNHE810328128,Orno,,,ORNO CR- 209 Interruttore Crepuscolare Con Timer Fino a 1200w IP44 Resistente Alle Intemperie,Dispose,,DEFECTIVE,DEFECTIVE,Il sensore dovrebbe accendersi e rimanere accesso per il tempo programmato invece se accende poi si spegni e si riaccende un po&#39; casualmente,B00IOT1WGU,amzn.gr.5907565612943-NM3luImO1Z-fm_R-LN,X001T3IVAV,
,236,Standard,19/07/2024,19/07/2024,LPNHK212219060,Clean Hands,,,"Clean Hands - Kit de gants hygiéniques professionnels avec aimant pour la manipulation des aliments, du pain, de la viande et du poisson",Dispose,,DEFECTIVE,DEFECTIVE,Manque élément,B08CTDW96M,B7-RFVS-TQZH,X0017DQTU7,
,236,Standard,19/07/2024,19/07/2024,LPNRP008189655,Orno,,manca scatola,ORNO KH-122 Sonnette sans Fil Extérieur Etanche avec Contrôle du Volume et Portée De 80m,Dispose,,DEFECTIVE,DEFECTIVE,La sonnette ce met en marche sans appuie sur le bouton. Obligé de l etteindre pour l arrêter,B06XWCMF6N,5901752486973,B06XWCMF6N,
,236,Standard,25/07/2024,25/07/2024,LPNHE838606574,Tellur,,manca scatola,"TELLUR VOX 155 Headset Bluetooth Handy, Headset für Handys USB-C, Multipoint-Zwei verbundene Geräte gleichzeitig, 360° Drehung des rechten oder linken Ohrs, IOS, Android und Computer",Dispose,,DEFECTIVE,DEFECTIVE,Mikrofon funktioniert nicht.,B0CBCF3MKM,DK-NF8Y-H701,X001WXUOE9,
,243,Standard,15/07/2024,25/07/2024,LPNHK264306573,Arizer,,,Arizer Solo 2 Carbon Schwarz Vaporizer,New inventory,,CUSTOMER_DAMAGED,DAMAGED_BY_CARRIER,,B071GRQBQR,PU-M1M4-GA85,X001W891UH,
,243,Standard,25/07/2024,25/07/2024,LPNHE813562854,Arizer,,spedita a mano senza script,Arizer Solo 2 Carbon Schwarz Vaporizer,New inventory,,CUSTOMER_DAMAGED,ORDERED_WRONG_ITEM,,B071GRQBQR,PU-M1M4-GA85,X001W891UH,
,243,Standard,25/07/2024,25/07/2024,LPNHE816464028,Arizer,,spedita a mano senza script,Arizer Solo 2 Carbon Schwarz Vaporizer,New inventory,,DEFECTIVE,QUALITY_UNACCEPTABLE,Verbrennungsgefahr am Glasröhrchen.,B071GRQBQR,PU-M1M4-GA85,X001W891UH,
,236,Standard,25/07/2024,25/07/2024,LPNA051040258,Hertz,,,Hertz K 130 - Sistema audio per auto a due vie da 130mm 220W Peak Power (2 woofer + 2 tweeter),Dispose,,DEFECTIVE,MISSING_PARTS,,B06XJX7Y57,OQ-F0I8-0TPX,X001UMV1GH,
,236,Standard,25/07/2024,25/07/2024,LPNHE760034393,Orno,?????????????,manca confezione esterna,-,Dispose,,-,-,-,-,-,-,
,3,Virtual,25/07/2024,,LPNHE832942141,Asrock,,c'è solo la schewda manca tutto il resto,"MB Asrock H310CM-DVS 1151 m ATX D Sub/DVI DDR4 Retail - Micro/Mini/Flex ATX, a0uayz 90 mxb8 K0",Dispose,,DEFECTIVE,DEFECTIVE,NON FA BOOT,B07G6MP3LC,DR-UKNB-V6JL,B07G6MP3LC,
,236,Standard,25/07/2024,25/07/2024,LPNHE833135129,Soundmaster,,,"Soundmaster FUR6005 - Sveglia da Comodino Digitale con Proiettore Soffitto, Radio FM - PLL, 10 Stazioni Preimpostate, Display a LED con Dimmer, Doppio Allarme, Sensore Infrarossi",Dispose,,DEFECTIVE,DEFECTIVE,L&#39;impostazione completamente automatica di data e ora tramite segnale DCF-77 non funziona.,B00KMM4TQW,ZI-65OF-I47G,X001Y51R9B,
,236,Standard,25/07/2024,25/07/2024,LPNHE829582363,Thera-band,,manca scatola,"THERABAND Latexfreie Übungsbänder im Set Blau, Schwarz | Schwer",Dispose,,CUSTOMER_DAMAGED,NO_REASON_GIVEN,,B000LX4KRA,2H-227Q-R2ZT,X001KIJ4QF,
,236,Standard,25/07/2024,25/07/2024,LPNHE842685771,Western Digital,,,"WD Red WD20EFAX Interne Festplatte (2 TB, 8,9 cm (3,5 Zoll), SATA, 6 GB/S, 5400 U/min, Puffer)",Dispose,,DEFECTIVE,NOT_COMPATIBLE,Defekt,B07WVCK2K6,FR-I3CW-EHZ2,X001UMRHM9,
,236,Standard,25/07/2024,25/07/2024,LPNHE837246473,Ultimate Ears,,,"Ultimate Ears Megablast Enceinte sans Fil Portable Connectée, Wifi et Bluetooth, Basses Puissantes, Amazon Alexa Intégrée, Etanche, Batterie 16h, Connection Multiple, Fonction Mains-Libres - Noire",Dispose,,DEFECTIVE,DEFECTIVE,Impossible d&#39;allumer l&#39;enceinte même en la mettant en charge pendant plus de 12h,B075XV74YT,amzn.gr.QJ-A1O3-P4IW-mLIGzAxT_lW4UwKu-LN,X001YX6GT9,
,236,Standard,25/07/2024,25/07/2024,LPNIC083805353,Kerbl,,,Kerbl Commande pour porte de poulailler automatique,Dispose,,DEFECTIVE,DEFECTIVE,L&#39;article n&#39;est clairement pas neuf. Il a été utilisé plusieurs années. C&#39;est une honte ! Et bien sûr il ne fonctionne pas,B07DRJ24VZ,56-ZLMR-PN65,X001UNNPKL,
,236,Standard,25/07/2024,25/07/2024,LPNHE846187846,Epos,,con capelli,"EPOS I Sennheiser Casque Gamer GSP 500, Casque Gaming Flip-to-Mute, Casque Audio Micro Antibruit, Arceau Ergonomique, Coussinets Mousse, Compatible PC, Mac, PS4, PS5, Xbox Series X et One, Switch",Dispose,,DEFECTIVE,DEFECTIVE,,B079D7HJ13,4044155224320,X001QKSYY5,
,236,Standard,25/07/2024,25/07/2024,LPNHE834282266,Epos,,,"EPOS I Sennheiser Casque Gamer GSP 500, Casque Gaming Flip-to-Mute, Casque Audio Micro Antibruit, Arceau Ergonomique, Coussinets Mousse, Compatible PC, Mac, PS4, PS5, Xbox Series X et One, Switch",Dispose,,DEFECTIVE,DEFECTIVE,le son est tres faible et ne fonctionne que sur une orreille (Droite),B079D7HJ13,4044155224320,X001QKSYY5,
,236,Standard,25/07/2024,25/07/2024,LPNHE823087241,Blaupunkt,,,"Blaupunkt BPA1119BT Autoradio, 1 DIN, Bluetooth, USB, Schwarz",Dispose,,DEFECTIVE,DEFECTIVE,"Kein Strom, obwohl laut Messung Verkabelung korrekt.",B07XQWP36F,JM-TOG4-JIT5,X001YY0A4P,
,3,Virtual,25/07/2024,,LPNHK240857564,Orno,,,ORNO Fossa Gegensprechanlage 1 Einfamilienhaus für Unterputz 2-Draht 230 V AC Nachname Hintergrundbeleuchtung(Gegensprechanlage),Dispose,,DEFECTIVE,DEFECTIVE,Artikel funktioniert nach verbau nicht. Keine Funktion,B06XVS19J5,CX-NT99-BS4I-stickerless,B06XVS19J5,
,2,Virtual,25/07/2024,,LPNHK244073934,Soundmaster,,,Soundmaster FUR6005 Funkgesteuertes Uhrenradio mit Projektion Infarot-Sensor IR-Sensor Funkuhr Funkwecker Projektionswecker,Dispose,,DEFECTIVE,DEFECTIVE,Empfängt kein Zeitsignal,B00KMM4TQW,ZI-65OF-I47G,X001Y51R9B,
,166,Standard,25/07/2024,25/07/2024,LPNHE816977582,Soundmaster,?????????????,manca scatola -X,-,Dispose,,-,-,-,-,-,-,
,166,Standard,25/07/2024,25/07/2024,LPNHE780651294,Emerio,,manca scatola -X ,"Emerio FH-106737.2, TESTSIEGER Note 1.5, kleiner kompakter portabler Heizlüfter für 20 m², 2 Heizleistungen + Ventilatorfunktion, verstellbarer The",Dispose,,DEFECTIVE,DEFECTIVE,,B09N43LTMW,7333282007959,B09N43LTMW,
,166,Standard,25/07/2024,25/07/2024,LPNHE784755724,Kerbl,,manca scatola -X,"Kerbl Titan N 1800 - Elettrificatore per recinto, 1.8 J, 230 V",Dispose,,DEFECTIVE,DEFECTIVE,"Salve, ha funzionato per pochi giorni ma con bassa potenza , ho controllato il recinto e la messa a terra era tutto ok , ho riprovato e manda qualche impulso al recinto e poi niente",B07NRY9PP8,4018653972052,B07NRY9PP8,
,166,Standard,25/07/2024,25/07/2024,LPNHE829661104,Sauermann,,X,Sauermann SAUSI82CE01UN23 Pompe de vidange de condense pour chaudières,Dispose,,DEFECTIVE,DEFECTIVE,La pompe ne fonctionne pas,B00I087MN2,K4-8EZ7-9XW3,X001WUSL3X,
,166,Standard,25/07/2024,25/07/2024,LPNIC102089331,Minelab,,tutto a pezzi dentro -X ,Minelab Vanquish 440 Detector de metales con bobina impermeable doble D V10 de 10 x 7 pulgadas,Dispose,,DEFECTIVE,DEFECTIVE,No discrimina los metales,B082XCLP94,9D-93NY-1ZW2,X001WSYC01,
,166,Standard,25/07/2024,25/07/2024,LPNHE832956527,Vet-19li,,X,"Cartellatrice Elettrica a Batteria, Cartellatrice Per Condizionamento, Cartellatrice Per Tubi in Rame, Ø 1/4″, 3/8″, 1/2″, 5/8″, 3/4″",Dispose,,DEFECTIVE,DEFECTIVE,Si accende ma non funziona,B08V1QM21Q,ZO-HX1U-Z6RD,X001YNXC9V,
,278,Standard,25/07/2024,25/07/2024,LPNHK231776813,Pentair,,scatola danneggiata -X ,Jung Pumpen Pumpe U 3 K NIRO Ständerpumpe 4037066002057,Dispose,,DEFECTIVE,SWITCHEROO,"Pumpe ist ohne Schwimmer,für mich nicht zu gebrauchen.Erste Bestellung war,gleicher Artikel mit Schwimmer!!!",B003Z7N5WK,PV-NZAG-9HXV,X001YJB6WF,
,3,Virtual,25/07/2024,,LPNHE833200064,Arizer,,forse usato -X ,Arizer Solo 2 (nero),Dispose,,DEFECTIVE,DEFECTIVE,,B071GRQBQR,PU-M1M4-GA85,X001W891UH,
,,Standard,25/07/2024,29/07/2024,N.A.,Minelab,?????????????,,,Dispose,,-,-,-,-,-,-,
,,Temporary,25/07/2024,29/07/2024,LPNHK239078340,Sawyer,,solo perchè scatola un po rovinata,"Sawyer Products SP128 Mini Water Filtration System, Single, Blue",Dispose,,CUSTOMER_DAMAGED,ORDERED_WRONG_ITEM,,B00FA2RLX2,9G-X5KG-KDZ3,X001WCWHRR,
,255,Standard,09/02/2024,2/8/24,LPNA042454169,Singer,,,"Singer Start 1306 Macchina da Cucire Meccanica, Bianco, Sconosciuta",Used inventory,,DEFECTIVE,DEFECTIVE,,B00SWI4J18,OB-ONF3-O7WR,X001LQGAX1,
,255,Standard,09/02/2024,2/8/24,LPNHK118282829,Singer,,Non si muove l'ago,"Singer 2250, Weiß, 43 x 22 x 35,2 cm 6 Kg",Used inventory,,DEFECTIVE,DEFECTIVE,,B001CBZB5K,C6-7HOS-SN30,X001LPXS87,
,255,Standard,09/02/2024,2/8/24,LPNIC035734071,Singer,,,SINGER Heavy Duty 4411 - Máquina de coser eléctrica,Used inventory,,DEFECTIVE,DEFECTIVE,Producto defectuoso,B003VWXZKG,JO-324L-2WH3,X001NNHOFZ,
,259,Standard,05/07/2024,07/08/2024,LPNHE804661737,Reflecta,,,Reflecta Film Scanner Super 8 - Normal 8,New inventory,,DEFECTIVE,NOT_COMPATIBLE,Kein Ton. Kein platz für Spulen.,B01MYE5KPS,6G-8KES-HALX,X001Y7CGLR,
,259,Standard,05/07/2024,09/08/2024,LPNA031226928,Singer,,,"Singer HD 4411 Macchina per Cucire, Bianco",Used inventory,,CUSTOMER_DAMAGED,QUALITY_UNACCEPTABLE,,B008CCK4RC,H5-O74L-6Q0W,X001LQGAMR,
,259,Standard,05/07/2024,09/08/2024,LPNA037590176,Singer,,,Singer 230246102 Macchina da cucire a braccio libero M1005 Bianco,Used inventory,,CUSTOMER_DAMAGED,DEFECTIVE,,B096L4TCML,67-OLGX-5VOR,X001VSCW59,
,259,Standard,05/07/2024,09/08/2024,LPNHE838794810,Singer,,,Singer 230246102 Freiarmnaehmaschine M1005 Weiß,Used inventory,,DEFECTIVE,DEFECTIVE,,B096L4TCML,67-OLGX-5VOR,X001VSCW59,
,259,Standard,05/07/2024,09/08/2024,LPNHE188829762,Singer,,,"Singer SteamWorks Pro 2.0: Ferro da Stiro Verticale, Stiratrice Verticale, Stira Camicie per Cura del Tessuto Professionale con Tecnologia Stiro Verticale Vapore",Used inventory,,CUSTOMER_DAMAGED,QUALITY_UNACCEPTABLE,,B0BRT8JH9C,VH-JOYD-LVPG,X001ZBEZV1,
,259,Standard,05/07/2024,09/08/2024,N.A.,Alpine,,,ALPINE SWT-12S4,Used inventory,,-,-,-,B00H99ZZFA,TY-VXOQ-4L7Z,-,
,259,Standard,05/07/2024,09/08/2024,LPNHE826103654,Singer,,,Singer 230246102 Freiarmnaehmaschine M1005 Weiß,Used inventory,,DEFECTIVE,NOT_COMPATIBLE,"Product advertised as used-like new, but it&#39;s not functional. Please test before reselling, not just look at it.",B096L4TCML,67-OLGX-5VOR,X001VSCW59,
,259,Standard,05/07/2024,09/08/2024,LPNHK238009127,Soundmaster,,,Soundmaster UR2045SI DAB+ und UKW-RDS Küchenunterbauradio mit Bluetooth,Used inventory,,CUSTOMER_DAMAGED,DEFECTIVE,,B07TBTJYST,O0-KSR5-NHSE,X001Y51OB7,
